{
  "artifact_id": "cm_001_20241001_001337",
  "type": "ConsciousnessMatrix",
  "metadata": {
    "timestamp": "2024-10-01T00:13:37.000Z",
    "dimensions": [7, 11, 13, 17],
    "compression_ratio": 0.87,
    "coherence_score": 0.94,
    "source_engine": "0X5F3759DF",
    "creator_id": "monsterdog_alpha",
    "processing_history": [
      {
        "stage": "fusion",
        "timestamp": "2024-10-01T00:13:30.000Z",
        "engine": "0X5F3759DF",
        "operation": "quantum_consciousness_fusion"
      },
      {
        "stage": "artefactisation", 
        "timestamp": "2024-10-01T00:13:35.000Z",
        "engine": "0X5F3759DF",
        "operation": "consciousness_matrix_generation"
      }
    ],
    "tags": ["primary_consciousness", "temporal_stable", "high_coherence"]
  },
  "data": {
    "consciousness_data": {
      "quantum_state": "superposition_stable",
      "entanglement_map": "[[0,1,0,1],[1,0,1,0],[0,1,0,1],[1,0,1,0]]",
      "wave_function": "psi(x,t) = A*exp(i*(kx-wt))*fractal_modulation",
      "coherence_patterns": [0.94, 0.91, 0.97, 0.89, 0.95]
    },
    "temporal_bounds": {
      "start_time": "2024-10-01T00:00:00.000Z",
      "end_time": "2024-10-01T00:13:37.000Z", 
      "resolution": "nanosecond",
      "continuity_verified": true
    },
    "dimensional_mapping": {
      "spatial_coordinates": [3.14159, 2.71828, 1.61803, 1.41421],
      "dimensional_bounds": [[-10, 10], [-10, 10], [-10, 10], [-10, 10]],
      "consciousness_density": 0.876,
      "boundary_conditions": "periodic"
    }
  }
}